,Unnamed: 0,season,episode_number,episode_title,author,quote
37145,45377,8,10,Monica`s Boots,Phoebe,Sting has a son that goes there too!
13073,16829,3,21,The Chick And The Duck,Ross,"There you go! Good enough for your party, huh?"
3676,4815,1,20,The Evil Orthodontist,Rachel,"Oh, do I?"
36990,45194,8,9,The Rumor,Monica,What?
30201,37025,7,3,Phoebe`s Cookies,Chandler,"(getting up) All right, Im off to see your dad."
22019,27582,5,16,The Cop,Joey,It-it doesnt?
35921,43837,8,4,The Videotape,Monica,What about my questions?
34559,42139,7,22,Chandler`s Dad,Joey,Yeah! Okay! (He notices a beautiful woman sitting behind the couch and goes to talk to her.) Hey! Hi!
36550,44633,8,7,The Stain,Phoebe,Oh.
15316,19685,4,8,Chandler In A Box,Joey,(answering phone) Stop callin!!
12144,15628,3,17,The Ski Trip,Rachel,"You guys are gonna love meee! Okay, check it out, Thursday night, five tickets, Calvin Klein lingerie show, and you guys are coming with me. (theyre all silent and look away) Okay, I said that out loud right?"
36297,44290,8,6,The Halloween Party,Rachel,"(to the cowgirl) And you are so in style right now. Yknow, I work at Ralph Lauren and the whole fall line has got this like equestrian theme going on. I dont suppose you saw the cover of British Vogue, but"
17272,22111,4,17,The Free Porn,Chandler,Its the theme from Good Will Humping.
11999,15481,3,16,The Morning After,Rachel,Just get away from me!
28727,35279,6,21,Ross Meets Elizabeth`s Dad,Phoebe,(writing in her book) Marcia and Chester are mad at Phyllis.
14825,19118,4,5,Joey`s New Girlfriend,Joey,(entering) Hey!
4690,6104,2,1,Ross`s New Girlfriend,Rachel,"Yeah, he`s back. Is that a problem?"
26828,33052,6,13,Rachel`s Sister,Ross,"Oh yeah, how about you and the, (mimics her fake cry) `Im sorry!`"
40369,49174,9,1,No One Proposes,Joey,"No! No, and I did not ask her to marry me!"
6907,9287,2,15,Ross And Rachel... You Know,Monica,You too.
5291,6830,2,5,Five Steaks And An Eggplant,Chandler,"I`m hoping that when Bob doesn`t show up, she will seek comfort in the open arms of the wry stranger at the next table."
49314,60069,10,17,"The Last One, Part I & II",Joey,Oh!
34148,41671,7,21,The Vows,Phoebe,"Oh, look, twins. Hi, guys. Oh, cute, cute."
41843,51065,9,8,Rachel`s Other Sister,Rachel,Alright. Thats it! <Pushes Amy back>
40042,48804,8,23,Rachel Has A Baby,Rachel,"Dont say, `Oh my God!` Oh my God what?"
29695,36496,7,1,Monica`s Thunder,Monica,"Fair enough, now go get ready!"
26483,32649,6,11,The Apothecary Table,Monica,Good night! (They go into their respective apartments.)
5128,6624,2,4,Phoebe`s Husband,Monica,"Oh it`s not big, not at all, you know, kinda the same lines as, say, oh I don`t know, having a third nipple."
36974,45174,8,9,The Rumor,Ross,(laughs) Yeah.
28445,34936,6,20,Mac And C.H.E.E.S.E.,Chandler,How is that worse?!
17662,22597,4,19,All The Haste,Ross,"I mean, why not! I mean, I mean why not?!"
40208,48995,9,1,No One Proposes,Chandler,Sure.
28637,35173,6,21,Ross Meets Elizabeth`s Dad,Rachel,Ohh. (She touches his arm for support and likes what she feels) Ooh!
2725,3426,1,15,The Stoned Guy,Monica,"Yeah, Chandler... you`ve been there for five years."
14469,18649,4,3,The Cuffs,Chandler,Freedom!
28746,35311,6,21,Ross Meets Elizabeth`s Dad,Ross,"Uh yeah, I guessYeah! I guess so."
39351,47941,8,21,The Cooking Class,Monica,"Oh my God, this is horrible!"
23635,29477,5,23,In Vegas,Phoebe,On a totally different bet.
35612,43501,8,3,Rachel Tells...,Phoebe,Well why dont you use your key?
12352,15860,3,17,The Ski Trip,Joey,"Come on man, you drove all the way up here."
23723,29565,5,23,In Vegas,Ross,You weren`t trying to entice me with your nakedness.
5330,6870,2,5,Five Steaks And An Eggplant,Ross,Go.
17441,22312,4,18,Rachel`s New Dress,Monica,"Yeah, you were, but you decided to make salmon because you had some left over at the restaurant. And then you realised if you (Points at Rachel) bitched about it, then you (Points to herself) would stop cooking, and you (Points at Rachel) would have to make your famous baked potato and Diet Coke."
10841,14009,3,10,Rachel Quits,Chandler,"Well seeing that drunk Santa wet himself, really perked up my Christmas."
15995,20510,4,11,Phoebe`s Uterus,Monica,"Sweetie, with you its gonna be different. The sex is gonna be great, cause you-you guys are in love."
15642,20096,4,9,They`re Going To Party,Joey,Hey! What are you guys doing here? I thought youd be out partying with Gandel-worf.
2737,3438,1,15,The Stoned Guy,Chandler,Yeah... I just don`t have that much cheffing experience. Unless it`s an all-toast restaurant.
27005,33258,6,14,Chandler Can`t Cry,Chandler,"Oh, thats Parents Day, first grade. Thats me with the janitor Martin."
36502,44572,8,7,The Stain,Phoebe,"Ive got friends too. Okay, bye."
15536,19948,4,8,Chandler In A Box,Phoebe,"Oh, there they are!"
13484,17355,3,23,Ross`s Thing,Monica,I guess that`s how.
18507,23537,4,23,Ross`s Wedding,Rachel,Who are you saying `check` too?
38867,47332,8,18,In Massapequa,Rachel,Oh
45041,54911,9,23,In Barbados,Chandler,I think this is the first time in our marriage that I`ve felt like the more attractive one.
27154,33454,6,14,Chandler Can`t Cry,Rachel,Bye-bye-e!
38923,47409,8,18,In Massapequa,Joey,"I guess it couldve been, I didnt really look at it. Yknow, I just wiped it on Chandlers coat and got the hell out of there."
20378,25717,5,8,The Thanksgiving Flashbacks,Rachel,"Okay, oh, here`s what you do. Just act like everything around you turns you on."
17065,21837,4,16,The Fake Party,Ross,Monica said that did she? (He squeezes Monicas knee really hardly and Monica winces in pain.)
48813,59509,10,16,Rachel`s Going Away Party,Chandler,I didn`t know Monica had these!
11390,14684,3,13,Monica And Richard Are Just Friends,Ross,"Yeah, yeah, yeah!"
7327,9757,2,17,Eddie Moves In,Chandler,"Oh, I couldn`t be happier."
32144,39263,7,12,They`re Up All Night,Chandler,"Shhhhhhhhh!!! (Monica enters) Im sorry, I thought maybe Id make some warm milk and it would help me sleep."
47482,57873,10,10,Chandler Gets Caught,Ross,"And hey, here`s to a lousy Christmas."
49180,59925,10,17,"The Last One, Part I & II",Ross,"No, and I`m not going to."
31451,38461,7,9,All The Candy,Monica,Im gonna hang this basket (Points to the one sitting on the table) on the door and when the neighbors walk by they can all take a piece.
38460,46846,8,16,Joey Tells Rachel,Rachel,"Of course, of course."
34008,41514,7,20,Rachel`s Big Kiss,Ross,When I got married you slept with my sister.
26834,33062,6,13,Rachel`s Sister,Chandler,"I know, lets rest and drink lots of fluids. (Holds up a glass of orange juice.)"
31232,38211,7,8,Chandler Doesn`t Like Dogs,Chandler,Oooh that may be a New World`s record (Looks at his watch and picks up Ross` pad)
18970,24064,5,2,All The Kissing,Chandler,"Ahh, no thanks. No chicken, bye-bye then."
14170,18276,4,2,The Cat,Ross,"(whispering in her ear) Oh, thats right! He called to ask out Monica! That-thats gotta be embarrassing!"
13839,17871,3,25,At The Beach,Monica,Strip Happy Days Game?
35954,43870,8,4,The Videotape,Monica,(taking Rachels hand) Sweetie okay. Its okay. Everybody made it to the wedding. Im fine.
44860,54667,9,23,In Barbados,Rachel,Do ya?
28282,34746,6,19,Joey`s Fridge,Monica,Okay! Okay! We can take a hint! (They start to leave but run into Phoebe with her guy in tow.) (To Phoebe) What are you doing here?!
41300,50257,9,6,The Male Nanny,Monica,"Yeah, a-a-and clean. Not just health department clean... Monica clean."
18042,23026,4,20,The Wedding Dresses,Phoebe,Not after this!
17968,22952,4,20,The Wedding Dresses,Monica,"Look at me! My big concern is whats real?! (Finally realises) Oh my God. Were really sad, arent we?"
11755,15164,3,15,Ross And Rachel Take A Break,Ross,Yeah!!
16919,21628,4,15,All The Rugby,Ross,All right.
15164,19511,4,7,Chandler Crosses The Line,Chandler,"(to Kathy) Uhh, that was Joey. Hes running a little late, he says hes sorry."
2158,2672,1,11,Mrs. Bing,Monica,"This is so typical. Y`know, we give, and we give, and we give. And then- we just get nothing back! And then one day, y`know, it`s just, you wake up, and `See you around!` Let`s go, Phoebe."
21666,27178,5,14,Everybody Finds Out,Phoebe,Chandler.
46196,56320,10,5,Rachel`s Sister Babysits,Ross,"Well, for one thing, she keeps calling her Ella! Rachel: (Defends Amy) Wha.. well, Ella`s a nice name!"
33227,40607,7,16,The Truth About London,Rachel,No! Wait! Come on!
48,50,1,1,Monica Gets A Roommate,Monica,Who wasn`t invited to the wedding.
4785,6206,2,2,The Breast Milk,Joey,"Yeah, we know, but there`s a baby suckin` on it."
33163,40534,7,16,The Truth About London,Monica,Noo!! The point is that is was you that was there that night! It is you that I am marrying! It is you that I feel in love with!
39101,47641,8,20,The Baby Shower,Rachel,"What?! You mean theyre not coming to a social event where theres no men and theres no booze?! Thats shocking! I dont care, as long as my moms here."
10912,14099,3,11,Chandler Can`t Remember Which Sister,Chandler,Hello-dillillio!!
9773,12752,3,5,Frank Jr.,Chandler,"Yeah, y`know what I got a better idea. How-how bout it blocks none of mine door and a lot of yours? (throws his shoulder into the center to try and move it, but it doesnt move.)"
47294,57676,10,10,Chandler Gets Caught,Monica,Hey! You smell like perfume and cigarettes.
45798,55842,10,3,Ross`s Tan,Joey,So...
31127,38072,7,7,Ross`s Library Book,Joey,"No! No! No! You guys were totally right! This is so much better than the first time we went out. Yknow? That was so awkward, we were really nervous."
10949,14141,3,11,Chandler Can`t Remember Which Sister,Monica,Isnt that great?
36911,45092,8,9,The Rumor,Monica,"Anyway, it just doesnt seem worth it to make a whole turkey for just three people. Okay? Its a lot of work."
40158,48939,8,23,Rachel Has A Baby,Rachel,Ive just been thinking about how my baby and I are gonna be all alone.
7645,10167,2,19,Eddie Won`t Go,Ross,"Uh Joey, that`s just the minumum amount due, that`s your total due."
5963,7888,2,9,Phoebe`s Dad,Phoebe,"Wow, this is it, I`m gonna meet my dad. This is like the biggest thing ever, huh."
47677,58128,10,11,The Stripper Cries,Chandler,"Oh please, and you knew how much I liked her."
15817,20299,4,10,The Girl From Poughkeepsie,Chandler,"See, Im not bad at this fixing up thing, huh?"
11095,14309,3,11,Chandler Can`t Remember Which Sister,Rachel,"(to Ross) Oh my God!! (she turns around and hugs Mark, not Ross)"
12620,16237,3,19,The Tiny T-Shirt,Chandler,Youre our age!
25086,31062,6,5,Joey`s Porsche,Rachel,"Uh yes, heroin and crack."
5934,7859,2,9,Phoebe`s Dad,Chandler,OK.
16995,21741,4,15,All The Rugby,Monica,All right. The super couldnt figure out what it did. A $200 an hour electrician couldnt figure out what it did. Ive had seven pretty serious shocks. I officially give up.
27632,33988,6,15,"That Could Have Been, Part I & II",Chandler,"Yeah! When you were talking about Roger, that was killing me! Look, things like last night they dont just happen. Yknow? Or at least not to me. Or with the other two women, in the morning yknow I was just lying there and I couldnt wait to just go hang out with my friends, but with you I always yknow with a friend."
14976,19295,4,6,The Dirty Girl,Rachel,You know what we should all do? Go see a musical.
47301,57683,10,10,Chandler Gets Caught,Chandler,And the wiggle wharms and the zip zorps? (pause) What were the things you said?
2209,2733,1,12,The Dozen Lasagnas,Rachel,I know...
24627,30544,6,3,Ross`s Denial,Chandler,"Hi, listen, Im sorry about before. I dont need to have a game room. I mean when I was a kid I only played those games because I couldnt get girls, and now I can emNow, I have you. (Monica glares at him.) Not-not that I think that I have you or think of you as property in any sort of way, I see women"
3258,4337,1,18,All The Poker,Ross,Alright.
5347,6891,2,5,Five Steaks And An Eggplant,Ross,Monica!
37422,45741,8,11,Ross`s Step Forward,Chandler,"Oh uh, as it turns out, we cant do it. Monica has to work."
42814,52208,9,15,The Mugging,Monica,"Ross, you did not come up with `got milk?`"
28492,34986,6,20,Mac And C.H.E.E.S.E.,Rachel,That is the most ridiculous...
24889,30823,6,4,Joey Loses His Insurance,Ross,Will you-will you please?
29742,36543,7,1,Monica`s Thunder,Phoebe,Why?!
35806,43716,8,4,The Videotape,Rachel,That-that you came on to me?
41851,51079,9,8,Rachel`s Other Sister,Chandler,Okay. Thats better. Now I want you to both apologize to each other and mean it.
23787,29629,5,23,In Vegas,Ross,(loudly so that everyone can hear) Hey lady! I don`t care how much you want it! Okay?! I am not gonna to have sex with you in the bathroom! (Rachel sinks lower on her chair trying to hide.)
16734,21394,4,14,Joey`s Dirty Day,Chandler,"No thanks, Mom!"
21826,27357,5,15,The Girl Who Hits Joey,Joey,No-no.
20472,25824,5,9,Ross`s Sandwich,Ross,Someone at work ate my sandwich!
40791,49625,9,3,The Pediatrician,Phoebe,"Wow, you guys go way back then. So what are you up to these days?"
31224,38203,7,8,Chandler Doesn`t Like Dogs,Rachel,(counting the place settings) How come we have one extra place setting?
45759,55800,10,3,Ross`s Tan,Chandler,"Well, aren`t you a treat."
30945,37871,7,6,The Nap Partners,Rachel,What?!
26928,33180,6,13,Rachel`s Sister,Ross,Hi (sees Rachel and forgets her name for a moment).
21766,27285,5,15,The Girl Who Hits Joey,Ross,Huh.
14050,18133,4,1,The Jellyfish,Phoebe,"Well, Im ready to get the hell out of here! (Sees Ross and Rachel cuddling on the couch.) Oh. Are you? Are you?!! (they nod Yes.) Ohh! Thats so great!! Ooh, not for Bonnie. (they nod No.) But for you, yay! Ohh."
3438,4521,1,19,The Monkey Gets Away,Ross,"Well, I added the `exactly like me` part... But she said she`s looking for someone, and someone is gonna be there tonight."
21644,27155,5,14,Everybody Finds Out,Chandler,Yes.
43800,53376,9,19,Rachel`s Dream,Chandler,"Dude, you`re shaking!"
2965,3980,1,17,"The Two Parts, Part II",Rachel,"..so, he said it was just a sprain, and that was it."
7535,10033,2,18,Dr. Ramoray Dies,Ross,No. [sound of Dr. Remore`s body hitting the bottom of the shaft] Now maybe.
30073,36896,7,3,Phoebe`s Cookies,Chandler,Really?
10951,14143,3,11,Chandler Can`t Remember Which Sister,Monica,"Oh, he is. And he is so dreamy. I mean, y`know what, when he left I actually used the phrase, Hummina-hummina-hummina. (walks away)"
38799,47237,8,17,The Tea Leaves,Rachel,My gynecologist tried to kill me.
5034,6517,2,3,Heckles Dies,Joey,"Well, I don`t know. I don`t know what we`re gonna be doin`. I mean, what if we`re at her folks` place?"
42869,52290,9,15,The Mugging,Phoebe,No.
37569,45912,8,12,Joey Dates Rachel,Joey,"No! No. Umm, just myself and if they dont like me for(Laughs.) Im sorry I couldnt even get through that."
11988,15470,3,16,The Morning After,Chandler,"Oh, thats mature."
115,121,1,1,Monica Gets A Roommate,Joey,"Ross, let me ask you a question. She got the furniture, the stereo, the good TV- what did you get?"
33182,40555,7,16,The Truth About London,Ross,Whats her last name?
41846,51070,9,8,Rachel`s Other Sister,Phoebe,Oh my god! Shouldn`t we stop this?
2425,2987,1,13,The Boobies,Phoebe,"I know, I know. So sweet... and so complicated. And for a shrink, he`s not too shrinky, y`know?"
19965,25191,5,6,The Yeti,Ross,"Look, this is hard enough! I really need you guys right now."
1035,1257,1,5,The East German Laundry Detergent,Chandler,How do you do that?
33500,40935,7,18,Joey`s Award,Ross,Well that brings me in the loop a little.
40154,48935,8,23,Rachel Has A Baby,Rachel,Nothing.
36422,44461,8,6,The Halloween Party,Phoebe,Yknow the only reason hes marrying you is because he thinks all the things you were saying about yourself were true.
5448,7000,2,5,Five Steaks And An Eggplant,Monica,All right. We`re gonna go. It`s not for another six hours. We`re gonna go then.
3596,4720,1,20,The Evil Orthodontist,Joey,"No way! Mr.Salty is a sailor, all right, he`s got to be, like, thetoughest snack there is."
40649,49470,9,2,Emma Cries,Rachel,"Thats your new job, day and night, she starts crying I need you here."
49481,60266,10,17,"The Last One, Part I & II",Ross,"Me neither, okay? We are - we`re done being stupid."
18747,23818,5,1,Ross Says Rachel,Ross,Okay.
5083,6573,2,3,Heckles Dies,Chandler,In a bad way?
5834,7737,2,9,Phoebe`s Dad,Monica,"Money is so impersonal. Cookies says someone really cares... Alright, we`re broke, but cookies do say that."
13406,17257,3,23,Ross`s Thing,Chandler,"No, it`s... fancier than a pimple. Look Ross, why don`t you just go see a"
18830,23911,5,1,Ross Says Rachel,Chandler,"Wow, you look"
19071,24173,5,2,All The Kissing,Rachel,"Okay. Oh, uh, wait a minute, y`know what? I uh, I can`t decide this. Umm, okay, just hold on a second."
21098,26533,5,12,Chandler`s Work Laugh,Monica,"Yes, I`m sure! Rachel is there something that you want to talk me about?"
47391,57776,10,10,Chandler Gets Caught,Chandler,"Hey, that`s...`joincidence` with a `C`!"
20738,26136,5,10,The Inappropriate Sister,Chandler,"Well, why can`t you do them tomorrow?"
2898,3624,1,15,The Stoned Guy,Phoebe,Yeah! You know all those yummy noises? I wasn`t faking.
1046,1271,1,5,The East German Laundry Detergent,Ross,"You were incredible! Brand new woman, ladies and gentlemen."
41301,50258,9,6,The Male Nanny,Chandler,(clearly not so interested) Awesome.
43552,53083,9,18,The Lottery,Chandler,"You`re right, it has been you dream for over 15 seconds."
44887,54725,9,23,In Barbados,Chandler,"Oh, ain`t this nice? It`s so quiet, I could just lie here all day."
8844,11655,3,1,The Princess Leia Fantasy,Rachel,"Okay, who are you talking to when you do that?"
40591,49412,9,2,Emma Cries,Ross,"You know what, you can go, I just have to fill out some forms. (Tries to hold the pen but cant)"
10209,13280,3,7,The Race Car Bed,Joey,"All right, Jester man, look we wanna see the king."
49217,59965,10,17,"The Last One, Part I & II",Phoebe,"Oh, Jack Bing. I love that. Ooh, it sounds like a `40s newspaper guy, you know? `Jack Bing, Morning Gazette. I`m gonna blow this story wide open!`"
4665,6075,2,1,Ross`s New Girlfriend,Monica,"Sweetie, I wanted you to have him too."
28976,35635,6,23,The Ring,Rachel,"Okay. Hey, what are you thinking? What are you thinking right now?"
28080,34506,6,19,Joey`s Fridge,Rachel,Youre jokin right?
7007,9391,2,16,Joey Moves Out,Joey,"Well, you know that guy that`s on my show that`s in a coma? He`s havin` a brunch."
44743,54524,9,23,In Barbados,Chandler,"Tonight?! (looks at the ring) Isn`t an engagement ring supposed to have a diamond? (squints at the ring to emphasize how tiny the diamond is) Oh, there it is!"
19661,24868,5,5,The Kips,Chandler,"(watching TV, in fact, ER is on.) Nothing! It`s over! Dammit! This is regularly scheduled programming!"
35892,43808,8,4,The Videotape,Joey,Good luck.
3054,4104,1,17,"The Two Parts, Part II",Phoebe,"So... What`s the deal with umm, you and Joey?"
40266,49059,9,1,No One Proposes,Rachel,Hey!
8729,11536,3,1,The Princess Leia Fantasy,Phoebe,Hi Monica!
15434,19823,4,8,Chandler In A Box,Monica,"Hey, come on, Phoebe, you understand dont you?"
10648,13776,3,9,The Football,Monica,"All right Rachel, you sweep behind, Ill pitch it to you, you throw it down field to Phoebe. All right. Break."
21002,26428,5,11,All The Resulutions,Ross,"Maybe I should get another pair! Ooh, y`know, they-they had some with fringe all down the sides. (Chandler starts rubbing his temple again.) I`m gonna go kiss Ben goodnight. (He starts to head for Monica`s bedroom.) I can`t believe he thinks I`m a cowboy. (Pause.) I would make a good cowboy. (He struts into Monica`s room.)"
30096,36919,7,3,Phoebe`s Cookies,Chandler,Hey! Hows the boat?!
18075,23063,4,21,The Invitation,Ross,Sure. Why not?
12202,15687,3,17,The Ski Trip,Chandler,Beam me up Jesus.
665,822,1,4,George Stephanopoulos,Monica,"Well, if you want, you can stay with Rachel and me tonight."
32863,40166,7,15,Joey`s New Brain,Joey,You own the room. (She smiles and stares longingly into his eyes.) We should probably get-get uh
18016,23000,4,20,The Wedding Dresses,Ross,"So, I got us some reservations for Sunday night, okay? How about, Ernies at 9 oclock?"
17348,22190,4,17,The Free Porn,Ross,"Im gonna, Im gonna go to London and Im going to fight for her."
41918,51152,9,9,Rachel`s Phone Number,Rachel,Okay. You too. And I hope you score. (to Mike) Bye.
2503,3113,1,13,The Boobies,Joey,Just trying to get comfortable. I can`t sleep in my underwear.
43606,53137,9,18,The Lottery,Joey,(in pain) Oh!
27805,34176,6,17,Unagi,Joey,"All right Carl, were next. Now remember, what is not gonna be?"
39402,47998,8,21,The Cooking Class,Ross,Yeah! I-I teach it in my class.
7609,10125,2,19,Eddie Won`t Go,Joey,Anybody want a croan.
10091,13119,3,7,The Race Car Bed,Joey,Ahh!
29780,36581,7,1,Monica`s Thunder,Phoebe,"Oh, I see. (Exits angrily.)"
16274,20846,4,12,The Embryos,Rachel,14?
47960,58466,10,12,Phoebe`s Wedding,Ross,What? A dog? No! Rachel gets to choose.
20866,26283,5,11,All The Resulutions,Monica,"Hey Rach, maybe your resolution should be to umm, gossip less."
9800,12789,3,5,Frank Jr.,Ross,(to the rest of the gang) Were just gonna be friends.
39832,48504,8,23,Rachel Has A Baby,Monica,(freaking out) What-what-whats that now?!
31212,38191,7,8,Chandler Doesn`t Like Dogs,Ross,What? You forgot fourteen states?
17133,21919,4,16,The Fake Party,Rachel,What do you get? (She throws her pom-poms to Joey and Phoebe and performs a cartwheel.) Emily!! (Tries to do another one.) EmilWhoa!! (She falls in Chandlers room.) Okay! So thats me as a cheerleader! Ta-dum! (Gunthers the only one that claps.)
45332,55260,10,1,Joey and Rachel Kiss,Monica,"Well, if I had them taken out, then I wouldn`t be able to do this. (she pushes Chandler on the couch and brushes her hair and shells against Chandler`s chest) You like that, right? (again, she brushes her hair against his chest and hums...)"
45604,55619,10,3,Ross`s Tan,Joey,"NO! Not like that, no no. No, like this. (He starts lightly grazing Chandler`s thigh)"
3577,4698,1,19,The Monkey Gets Away,Ross,"It`ll be nice to get this off finally, won`t it? Yes it will. (Marcel resists) Or we can leave it on for now, that`s fine."
37588,45931,8,12,Joey Dates Rachel,Joey,"`Whered you grow up,` its so simple!"
1767,2174,1,9,Underdog Gets Away,Chandler,Now this feels like Thanksgiving.
44841,54647,9,23,In Barbados,Ross,"And then, you try to make the best of a bad situation, so you float the idea of a threesome?"
8861,11672,3,1,The Princess Leia Fantasy,Monica,"I`m sorry, but that`s my happy place."
26156,32268,6,10,The Routine,Ross,Why do they keep doing that?
4148,5402,1,22,The Ick Factor,Monica,It was.
41848,51073,9,8,Rachel`s Other Sister,Rachel,Ew! Gross.
31484,38498,7,9,All The Candy,Monica,Ross! The neighbors ate all my candy!!
22958,28700,5,20,The Ride Along,Joey,Of course you do! I saved him! You`re mad at me! It all adds up! You want Ross out of the picture.
8458,11176,2,23,The Chicken Pox,Joey,Hey.
26320,32480,6,11,The Apothecary Table,Rachel,Hey!
27022,33285,6,14,Chandler Can`t Cry,Rachel,Hey!
9444,12345,3,4,The Metaphorical Tunnel,Ross,"And that`s bad because..., you hate chicken piccata?"
382,446,1,2,The Sonogram At The End,Ross,"(they shake hands) Hello, Susan. (To Carol) Good shake. Good shake. So, uh, we`re just waiting for...?"
261,294,1,1,Monica Gets A Roommate,Rachel,I`m just serving it.
27107,33397,6,14,Chandler Can`t Cry,Phoebe,And-and youre using my name!
33673,41131,7,19,Ross And Monica`s Cousin,Phoebe,Whats the matter?
44007,53602,9,20,The Soap Opera Party,Rachel,"Yeah, it`s a real shame you can`t make it to that one-woman show tonight."
28132,34568,6,19,Joey`s Fridge,Chandler,A face ass?
9452,12353,3,4,The Metaphorical Tunnel,Joey,"Hey, you know about that?!"
7579,10095,2,19,Eddie Won`t Go,Joey,Hey.
35205,43036,8,1,`I Do`,Chandler,And the world will never know.
44514,54218,9,22,The Donor,Rachel,"I know, I know, so it is just not a big deal."
37086,45314,8,9,The Rumor,Ross,The eyesdid still sparkle.
32903,40221,7,15,Joey`s New Brain,Monica,"(breaks away) Oh wait, just one more thing! One more minute! (To Cecilia) Umm, youre a stupid bitch."
178,202,1,1,Monica Gets A Roommate,Monica,"Well, it`s like that. With feelings."
41617,50693,9,7,Ross`s Inappropriate Song,Chandler,"I had to! Okay, imagine you were married... and you found a tape of your wife in another guys` apartment... Wouldn`t you need to know what was on it?"
27338,33647,6,15,"That Could Have Been, Part I & II",Rachel,"Yeah sure, iced tea would be great."
18883,23975,5,1,Ross Says Rachel,Joey,But what about how much taller he is than me?
11558,14927,3,14,Phoebe`s Ex-Partner,Joey,"All right!! Okay, it was like four years ago. Okay, Ginger and I had gone out a few times, and then this one weekend, we went up to her Dads cabin. Just me, her, and her annoying little dog Pepper. Well that night, I cooked this really romantic dinner...."
47528,57919,10,10,Chandler Gets Caught,Ross,"Seriously you guys, what`s going on? What are these for?"
5156,6657,2,4,Phoebe`s Husband,Monica,"I can`t believe you`re dressing up for him. I mean, you`re just, you`re setting yourself up all over again."
31391,38391,7,8,Chandler Doesn`t Like Dogs,Joey,Hey! Tag`s still talking to the police.
34929,42602,7,23,Chandler And Monica`s Wedding,Chandler,I know about Monica.
47961,58467,10,12,Phoebe`s Wedding,Rachel,"(sarcastic) Wow, this is a tough one. I think I`m gonna have to go with the dog."
25385,31372,6,6,On The Last Night,Rachel,"Oh, its gonna be fine."
12278,15776,3,17,The Ski Trip,Joey,"Oh yeah, Smokey Joe here got half way to the highway and collapsed."
45917,55983,10,4,The Cake,Ross,"Hey Mon, that was really nice of you to loan Rachel your car so she could go and get the cake."
