,Unnamed: 0,season,episode_number,episode_title,author,quote
46618,56885,10,7,The Home Study,Phoebe,"Hey, that’s not fair! A person’s wedding is important! And especially to me! Ok? I didn’t have a graduation party! And I didn’t go to Prom. And I spent my sweet sixteen being chased round a tire yard by an escaped mental patient who is his own words wanted to “kill me” or whatever. So I deserve a real celebration and I am not gonna let some sweaty little man make me feel badly about it.( She storms out)"
7223,9638,2,17,Eddie Moves In,Ross,Get the what?
9622,12550,3,5,Frank Jr.,Chandler,"I know, I know, I just always wondered if I could get her eyes to pop out of her head."
14219,18326,4,2,The Cat,Rachel,"Yeah. Just, if its possible, could you leave him somewhere and go have sex with another guy?"
46852,57168,10,8,The Late Thanksgiving,Phoebe,Oh!
6509,8825,2,12,The Superbowl,Phoebe,"There we go.You know what, if we were in prison, you guys would be, like, my bitches."
17937,22905,4,20,The Wedding Dresses,Rachel,Hi!
36844,45017,8,8,The Stripper,Ross,So your dad dropped by. Hes a pleasant man!
32907,40227,7,15,Joey`s New Brain,Joey,(notices something in the mail that Rachel brought in) Oh my God!
2974,3990,1,17,"The Two Parts, Part II",Monica,"Come on, she`ll be here any minute."
31180,38148,7,7,Ross`s Library Book,Joey,Yeah?
11154,14373,3,12,All The Jealousy,Ross,This is Ross?
42992,52438,9,15,The Mugging,Phoebe,"Look, Ross, in this box are all the things I got from mugging that I thought were too special to sell or smoke. (Ross looks at her in astonishment) Anyway, I was looking through it and I found `Science Boy` (She holds up some sheets of paper and hands them to Ross)"
41903,51137,9,9,Rachel`s Phone Number,Ross,"Oh right, right. (They pause and exchange a glance. Then, Ross looks away.) So, are you ... ah ... you excited about your, your first night away from Emma?"
46813,57129,10,8,The Late Thanksgiving,Rachel,"Oh, Phoebe! Come on! You know what, it`s already three o`clock and they haven`t even gotten to Emma`s group yet. We gotta go, we got dinner!"
24451,30358,6,2,Ross Hugs Rachel,Monica,"Really well. Yeah. Surprisingly well. Yeah, she didnt cry. She wasnt angry or sad. (Sits down, slightly disgusted.)"
42746,52135,9,14,The Blind Dates,Joey,Because you two were having sex!
30107,36930,7,3,Phoebe`s Cookies,Rachel,What?! What?! He was trying to cheer me up! My pony was sick.
4938,6409,2,3,Heckles Dies,Ross,"I got it. Uh, Joey, women don`t have Adam`s apples."
35316,43172,8,2,The Red Sweater,Phoebe,Hey!
18634,23684,4,23,Ross`s Wedding,Phoebe,"So, did shopping make you feel any better about Ross?"
9975,12989,3,6,The Flashback,Chandler,"Noo!! You dont have a boyfriend because....I dont, I dont know why you dont have a boyfriend. You should have a boyfriend."
34241,41764,7,21,The Vows,Ross,(entering) What`s going on?
37642,45985,8,12,Joey Dates Rachel,Rachel,"you were 50 minutes late to the class, what did you crawl there?!"
7419,9861,2,18,Dr. Ramoray Dies,Chandler,"So, you uh, you think that Speed Racer guy gets a lot of tickets er?"
20068,25320,5,7,Ross Moves In,Monica,So-so there is no party.
47412,57798,10,10,Chandler Gets Caught,Monica,Deal!
15246,19615,4,7,Chandler Crosses The Line,Monica,You obviously havent screwed over a lot of your friends. (They all look at her) Which we all appreciate.
23672,29514,5,23,In Vegas,Chandler,I said art lover.
41171,50109,9,5,Phoebe`s Birthday Dinner,Ross,"Okay, well the ??? is not home."
33224,40603,7,16,The Truth About London,Ross,What? (She takes the sign off and hands it to him.) Thats great. That is great. (Crumples up the paper and throws it down in anger.) What did we just finish talking about Ben?!
37683,46030,8,12,Joey Dates Rachel,Phoebe,I know!
34448,41982,7,22,Chandler`s Dad,Phoebe,"No, its not! We were just goofing around and I dared him to try them on."
15754,20225,4,10,The Girl From Poughkeepsie,Joey,"Done! I did it! Heh, whos stupid now? (He smiles and has cookie remains all over his teeth.)"
35348,43204,8,2,The Red Sweater,Phoebe,I dont. He gothe-he-he-hes hit by a bus.
28793,35368,6,22,Paul`s The Man,Joey,"Oh well, its not on TV yet."
17780,22733,4,19,All The Haste,Chandler,"I dont care, this is our apartment! And they stoleyou stole itour apartment, and we won that apartment fair and square, twice! And I am getting it back right now. Im getting back right now!"
4541,5930,1,24,Rachel Finds Out,Monica,"I am not `so`! OK, I was a teensy bit weird at first, but... I`ll be good. I promise."
3436,4519,1,19,The Monkey Gets Away,Ross,"I`m telling you, she said she`s looking for a relationship with someone exactly like me."
24160,30051,6,1,Vegas,Monica,"Thats a good question. Look umm, last night we let the dice decide. Maybe we should leave it up to fate again. I love you!"
45763,55804,10,3,Ross`s Tan,Phoebe,You`re also so generous and kind and scrappy!
6569,8904,2,12,The Superbowl,Chandler,"No, no, you don`t have to see."
15630,20070,4,9,They`re Going To Party,Rachel,"(entering Joannas office) Umm, Joanna? I wanna talk about that interview."
13587,17539,3,24,The Ultimate Fighting Champion,Phoebe,(intrigued) Oh?!
9806,12795,3,5,Frank Jr.,Chandler,"Oh, I think I have the cash."
35458,43328,8,2,The Red Sweater,Rachel,"Nothing! Phoebe kinda made a mistake. But yknow you do wear that sweater a lot, are you involved in some kind of dare?"
5032,6515,2,3,Heckles Dies,Joey,"I don`t know, I`m just tryin` to help you out."
4500,5888,1,24,Rachel Finds Out,Rachel,"I don`t know. I don`t know... I thought about it all the way there, and I thought about it all the way back... and, uh, oh, you guys, y`know, it`s Ross. Y`know what I mean? I mean, it`s Ross."
1250,1526,1,7,The Blackout,Chandler,"Alright, alright, alright. It`s been fourteen and a half minutes and you still have not said one word. Oh God, do something. Just make contact, smile!"
14829,19122,4,5,Joey`s New Girlfriend,Joey,It`s 4:30.
1240,1514,1,7,The Blackout,Phoebe,"Well, I never call me."
39636,48277,8,22,Rachel Is Late,Rachel,In a minute!!!
34101,41623,7,20,Rachel`s Big Kiss,Chandler,Whose is it?
47866,58354,10,12,Phoebe`s Wedding,Chandler,"(almost crying) I wouldn`t know, I didn`t make it! (they hug)"
9955,12969,3,6,The Flashback,Monica,What? Im just said.
20713,26111,5,10,The Inappropriate Sister,Phoebe,"Well, yeah! But I`m not gonna take anymore crap. Okay? No more Mrs. Nice Bucket!"
5443,6995,2,5,Five Steaks And An Eggplant,Phoebe,Fine.
16262,20834,4,12,The Embryos,Joey,Everyday use.
35833,43743,8,4,The Videotape,Joey,All right! Ill have a sandwich!
28645,35181,6,21,Ross Meets Elizabeth`s Dad,Phoebe,"Well, why dont you just get him fired?"
30641,37532,7,5,The Engagement Picture,Ross,"(opens the door and to Whitney) Hi! Im sorry, but can you give me a second while I talk to this woman, who by the way did not spend the night."
42218,51511,9,10,Christmas In Tulsa,Chandler,I sent them home.
38586,46984,8,16,Joey Tells Rachel,Rachel,"Huh. Wow, I wouldnt think Hobbs would like that so much."
19019,24117,5,2,All The Kissing,Ross,"(breaking the hug) Ohh, I gotta go to the flower store! (Runs to the door.) Check it out, no one will tell me where Emily is, so I`m gonna send 72 long-stem, red roses to Emily`s parent`s house, one for each day that I`ve known and loved her. That oughta get her talking to me again."
15167,19517,4,7,Chandler Crosses The Line,Chandler,"Oh, I had an appointment to get my haircut"
6834,9212,2,15,Ross And Rachel... You Know,Monica,"[her and Phoebe tilt their heads] Oh, that`s too bad."
28580,35076,6,21,Ross Meets Elizabeth`s Dad,Monica,We know how tough those parent/teacher conferences can be.
3230,4304,1,18,All The Poker,Ross,"Um.... no. See, I might`ve had feelings for her at one timenot any more. I justI..."
31301,38284,7,8,Chandler Doesn`t Like Dogs,Joey,Told ya. (Waves bye-bye.)
45533,55531,10,2,Ross Is Fine,Chandler,But kids are so intuitive. Don`t you think on some level he already knows?
6504,8820,2,12,The Superbowl,Monica,OK.
12332,15840,3,17,The Ski Trip,Monica,(shyly) I dont know.
13533,17420,3,23,Ross`s Thing,Phoebe,(knocks on the door) Jason?
1524,1876,1,8,Nana Dies Twice,Ross,"What, we-uh- we don`t have shoes here, or...?"
24353,30254,6,2,Ross Hugs Rachel,Monica,I have some pretty exciting news!
21830,27361,5,15,The Girl Who Hits Joey,Monica,"Gunther, can I get a coffee (Looks at Chandler) to go?"
4681,6092,2,1,Ross`s New Girlfriend,Rachel,At his apartment. Is this juice?
24000,29870,5,23,In Vegas,Rachel,Hey!
12080,15563,3,16,The Morning After,Chandler,What?
41466,50468,9,6,The Male Nanny,Chandler,Oh yeah? Is he funnier than me?
2447,3020,1,13,The Boobies,Joey,"Dad, dad. (Shakes his head)"
24655,30573,6,3,Ross`s Denial,Joey,That thing was a hazard! (To the potential roommate) Im very safety conscious.
46662,56953,10,7,The Home Study,Monica,(Pulls Laura into the spare room) Why don`t I show you the baby`s room?
38639,47046,8,17,The Tea Leaves,Monica,"Hello? No rejection? I got shot down at fat camp! Boy, kids are mean when theyre hungry."
33830,41316,7,19,Ross And Monica`s Cousin,Joey,Wow! This looks great!
37247,45500,8,10,Monica`s Boots,Chandler,"What honey, its like fifteen blocks to the subway. Lets go."
8142,10787,2,21,The Bullies,Joey,[in the voice] Hard to say.
979,1190,1,5,The East German Laundry Detergent,Rachel,"(holds a pair of panties in front of Ross) Ok, Well, what about these are white cotton panties. Would they go with whites or delicates?"
26362,32522,6,11,The Apothecary Table,Rachel,"Ross, shes not weird, she just wants her stuff to be one of a kind."
11456,14775,3,13,Monica And Richard Are Just Friends,Rachel,No. She doesnt die.
49008,59720,10,17,"The Last One, Part I & II",Rachel,It really was. You`ve learned some new moves!
27995,34398,6,18,Ross Dates A Student,Joey,Ah whatever!
35277,43132,8,2,The Red Sweater,Chandler,(to the front desk clerk) Hi! Were checking out of the bridal suite.
730,901,1,4,George Stephanopoulos,Rachel,"Oh, God, ask them what they want."
10048,13071,3,7,The Race Car Bed,Ross,"Please, he refers to me as wethead."
43115,52596,9,16,The Boob Job,Phoebe,Yeah I get that.
5402,6954,2,5,Five Steaks And An Eggplant,Ross,Not at the concert.
15646,20100,4,9,They`re Going To Party,Chandler,"Yeah, and I-I gave first names to all of the foosball players."
46456,56680,10,6,Ross`s Grant,Joey,But it`s an original Buffay...
4814,6250,2,2,The Breast Milk,Joey,"Listen, I know you`re new, but it`s kinda understood that everything from Young Men`s to the escalator is my territory."
21219,26671,5,12,Chandler`s Work Laugh,Monica,I know! It`s just thatever since high school Rachel was the one person I told everything too. Y`know? I miss that so much now. She`s my best friend.
19943,25158,5,6,The Yeti,Rachel,Hi!
34918,42588,7,23,Chandler And Monica`s Wedding,Joey,"So I got your car, its right outside."
19961,25187,5,6,The Yeti,Phoebe,(To Chandler) You`re kinda stepping on the song. (She gets ready to play but is stopped by)
16119,20675,4,12,The Embryos,Joey,"Yeah, whats that about?"
2740,3441,1,15,The Stoned Guy,Phoebe,"Well, he wants to do some ecclectic, so he`s looking for someone who can, you know, create the entire menu."
6417,8710,2,12,The Superbowl,Chandler,"[to guys wering yellow isolation suits] So, are you guys in the movie, or are you just really paranoid."
8444,11152,2,23,The Chicken Pox,Rachel,"You see, you look beautiful. For god sakes, dim the lights."
5076,6566,2,3,Heckles Dies,Chandler,"If I`m gonna be an old, lonely man, I`m gonna need a thing, you know, a hook, like that guy on the subway who eats his own face. So I figure I`ll be Crazy Man with a Snake, y=know. Crazy Snake Man. And I`ll get more snakes, call them my babies, kids will walk past my place, they will run. `Run away from Crazy Snake Man,` they`ll shout!"
3327,4408,1,18,All The Poker,Ross,Let me see! Show them!
43190,52675,9,16,The Boob Job,Phoebe,What do you mean?
8137,10782,2,21,The Bullies,Rachel,She`ll be a much better friend when the market closes.
25958,32038,6,9,Ross Got High,Rachel,"Joey, God, your apartment is like a hundred degrees!"
14121,18225,4,1,The Jellyfish,Rachel,"Ooh, I just wish we hadnt lost those four months, but if time was what you needed just to gain a little perspective..."
41608,50678,9,7,Ross`s Inappropriate Song,Phoebe,"Yeah... Oh Bitsy, hi. Uhm... listen I just wanted to thank you again for having me here tonight."
34394,41919,7,22,Chandler`s Dad,Chandler,"Well he doesnt have to know! Its not like we run in the same circles. I hang out with you guys, and he stars in a drag show in Vegas."
2700,3387,1,14,The Candy Hearts,Ross,"No but, no but."
3462,4546,1,19,The Monkey Gets Away,Rachel,"Oh, my, God, c`mon, you guys! He`s gonna be home any minute! He`s gonna kill me!"
30660,37557,7,5,The Engagement Picture,Rachel,(Pause) Oh.
30063,36886,7,3,Phoebe`s Cookies,Joey,"Eyes! No, no. Your eyes! No. Chandlers eyes!"
19624,24828,5,5,The Kips,Rachel,"Oh my God, Le Poo, our dog!"
30469,37324,7,4,Rachel`s Assistant,Monica,I-I already told him everything! (Threateningly) You shush!!
40893,49765,9,3,The Pediatrician,Joey,"Dude, you see right thru me!! (They hug) (Joey heads for the door and pushes Chandler`s suitcase on the way out.)"
3413,4495,1,19,The Monkey Gets Away,Ross,"Wait-wait. I, I got it. I was there."
46487,56711,10,6,Ross`s Grant,Chandler,Lying is wrong!
17122,21900,4,16,The Fake Party,Joey,"Absolutely! I could be a vegetarian. Theres no meat in beer, right?"
35379,43235,8,2,The Red Sweater,Chandler,"I dont know, Monica picked out the flowers."
3242,4316,1,18,All The Poker,Monica,You`re kidding! Where? Where?
28137,34573,6,19,Joey`s Fridge,Phoebe,"Well my guy is spectacular. Okay? Hes a massage client and one time umm, when he was on the table, I looked at it. And I mean all of it."
774,951,1,4,George Stephanopoulos,Monica,Do you have a plan?
17599,22530,4,19,All The Haste,Ross,"So, then you can stay as long as you want."
18195,23191,4,21,The Invitation,Rachel,Who`s this from?
40115,48885,8,23,Rachel Has A Baby,Monica,"Yeah, but I love you more. Besides yknow, nothing goes with Bing. So Im screwed. I mean (Rachel hands Emma to Monica.) Oh, hi Emma. Yeah, thats you. Youre our little Em. Oh whats that honey? What? Oh, you want a little cousin? (To Chandler) You want a cousin right now?!"
441,554,1,3,The Thumb,Rachel,And everybody knows this?
19847,25057,5,6,The Yeti,Joey,"Hey, Ross, you`re okay with that?"
21251,26714,5,12,Chandler`s Work Laugh,Ross,Okay.
22049,27621,5,16,The Cop,Phoebe,"I-I sure will, take care. (Starts walking off.)"
46435,56653,10,6,Ross`s Grant,Monica,"(faking happiness) Oh, my!"
20336,25664,5,8,The Thanksgiving Flashbacks,Monica,"Well, I do."
37359,45651,8,11,Ross`s Step Forward,Joey,"Hey-hey-hey, hey thats your wife youre talking about!"
40889,49761,9,3,The Pediatrician,Rachel,Bye honey. (They hug)
15849,20331,4,10,The Girl From Poughkeepsie,Rachel,(entering) Chandler!! You have the best taste in men!
12835,16546,3,20,The Dullhouse,Monica,Youre kidding?! Thats great!
16065,20600,4,11,Phoebe`s Uterus,Joey,"Yeah, you hang in there Teddy!"
32838,40133,7,15,Joey`s New Brain,Chandler,"Well, I feel like a snack!"
19942,25157,5,6,The Yeti,Phoebe,"Well, I`ve been reading up and for your information, minks are not very nice. Okay, I admit it! I love this coat! Okay, Iit`s the best thing I`ve ever had wrapped around me, including Phil Huntley! (She starts to leave but stops and says to Monica.) Remember Phil Huntley? He was fine!"
5682,7281,2,6,The Baby On The Bus,Ross,I hope Ben has a little sister.
40998,49906,9,4,The Sharks,Rachel,"what, how do we know, we never slept with you."
16899,21606,4,15,All The Rugby,Chandler,"(to Janice) Okay. (to Joey) Joey, trade lives with me!"
33337,40752,7,17,The Cheap Wedding Dress,Joey,"Listen, sorry I didnt stop by last night but I had a date."
38589,46987,8,16,Joey Tells Rachel,Joey,"Uh-huh, long time."
6652,9015,2,14,The Prom Video,Monica,Hi.
27958,34357,6,18,Ross Dates A Student,Phoebe,Yknow what Joey left on my pillow?
30371,37211,7,4,Rachel`s Assistant,Phoebe,"(To Monica) Anyway, I should go. Okay, bye."
13986,18064,4,1,The Jellyfish,Phoebe,How close?
24231,30131,6,1,Vegas,Phoebe,Stop it! Stop it no! Thats not fair! Yknow I cant resist that beautiful voice!
41614,50690,9,7,Ross`s Inappropriate Song,Joey,"Hey dude, what`s up?"
1280,1560,1,7,The Blackout,Ross,Step back.
7931,10516,2,20,uld Yeller Dies,Rachel,"Yes, but I, I think about who`s apartment we`re gonna sleep at tomorrow night and, and where we`re gonna have dinner next Saturday night. I do not think about what our childrens` names are gonna be. You know what our childrens names are gonna be."
46797,57112,10,8,The Late Thanksgiving,Joey,"So we`ll leave before it`s over, we`ll be back in time."
7511,10000,2,18,Dr. Ramoray Dies,Rachel,Agghhh.
47198,57542,10,9,The Birth Mother,Monica,(sniffing) Maybe she will. Uh! Why couldn`t I have been a Reverend?
33460,40886,7,17,The Cheap Wedding Dress,Monica,"Oh. I guess you can. Okay but; I-I have to return it, so you cant like it."
12665,16303,3,19,The Tiny T-Shirt,Monica,I so wanna be attracted to you.
19710,24917,5,5,The Kips,Monica,Chandler stole a twenty from my purse!
13610,17565,3,24,The Ultimate Fighting Champion,Monica,"Okay, can we please go eat?"
2288,2838,1,12,The Dozen Lasagnas,Phoebe,"Oh, boy scouts could have camped under there."
25342,31329,6,6,On The Last Night,Monica,Because its my apartment!
47695,58147,10,11,The Stripper Cries,Monica,Oh my God Rach. Bean bag chairs.
33740,41198,7,19,Ross And Monica`s Cousin,Chandler,Thats me! Come on!
46005,56080,10,4,The Cake,Ross,"Some can sing, some can dance. I apparently can turn phallic cakes into woodland creatures."
11140,14355,3,12,All The Jealousy,Joey,(hanging up the phone) Yes! Guess who`s in an audition for a Broadway musical?
22937,28675,5,20,The Ride Along,Chandler,(pouting) It was a car backfire!
220,249,1,1,Monica Gets A Roommate,Rachel,I don`t think so.
16074,20618,4,11,Phoebe`s Uterus,Phoebe,Okay.
14434,18608,4,3,The Cuffs,Chandler,Fine!
15205,19574,4,7,Chandler Crosses The Line,Monica,"Okay. Umm, Phoebe, you suck too."
4430,5801,1,24,Rachel Finds Out,Rachel,"Oh, no, no, no. Presents first. Food later. (walks into living room)"
18654,23704,4,23,Ross`s Wedding,Phoebe,"All right, and umm (She grabs the picture and smacks her in the head.)"
29314,36060,6,24,"The Proposal, Part I & II",Phoebe,"Oh, en chante. (She holds out her hand for him to kiss it, but he only shakes it.)"
34992,42704,7,24,outtakesFriends Special: The Stuff You`ve Never Seen,Monica,It was so wild! We told em we were the Gundersons in 16
5840,7743,2,9,Phoebe`s Dad,Monica,"Oh, and the newspaper delivery guy."
34950,42630,7,23,Chandler And Monica`s Wedding,Chandler,You look beautiful. Is this new? (Her dress.)
25223,31210,6,6,On The Last Night,Monica,Youre not dressed yet?! Were supposed to start having fun in 15 minutes!
18862,23943,5,1,Ross Says Rachel,Chandler,"But, well stay here with you."
36560,44650,8,7,The Stain,Ross,Really?!
40470,49282,9,2,Emma Cries,Rachel,"Oh great, the pacifiers?"
32200,39334,7,12,They`re Up All Night,Chandler,No. We were in the middle of sexand you fell asleep.
22006,27569,5,16,The Cop,Monica,"Hey Joey, sweetie, taste this. (Holds out a spoon for him.)"
37811,46158,8,13,Chandler Takes A Bath,Rachel,"But I couldnt even if I wanted to, because I dont know! I swear; I didnt see anything, and I dont want to know! It was just a momentary lapse."
34453,41987,7,22,Chandler`s Dad,Joey,"Yeah, I wouldnt know about that."
301,346,1,2,The Sonogram At The End,Rachel,Has anybody seen my engagement ring?
9537,12459,3,4,The Metaphorical Tunnel,Chandler,Can I be that guy?
17558,22475,4,18,Rachel`s New Dress,Joey,"Nah, youre not tall enough to be a Mark, but you might make a good Barney."
29360,36113,6,24,"The Proposal, Part I & II",Ross,(in his head) Wow! I have never had such a healthy break-up! She was such a grown-up about it! She didnt seem too immature for me! Did I just make a huge mistake?
17892,22856,4,20,The Wedding Dresses,Monica,(laughs) Okay.
6291,8508,2,12,The Superbowl,Ross,Hey guys.
35383,43239,8,2,The Red Sweater,Chandler,That was her.
16602,21231,4,14,Joey`s Dirty Day,Rachel,"Oh, okay. Uhh, well lets see. (Grabs his hand.) Youre aboutwell uh, this one is large. And this one(Grabs the other hand.)"
733,904,1,4,George Stephanopoulos,Monica,"That is the unusual activity. Look, they just wanna see if you`re okay."
38655,47062,8,17,The Tea Leaves,Rachel,"Well, I have been spending a lot of time in the lab."
26220,32357,6,10,The Routine,Rachel,"This bench, its hollow! I cant believe I never knew that! (She pushes all the pillows off it and opens it up) Oh, the presents!!!"
16478,21083,4,13,Rachel`s Crush,Phoebe,"If you wanted to punish them, you shouldve just made them hang out here!"
27714,34076,6,17,Unagi,Monica,"Okay. (They kiss.) Okay, I cant wait! This is going to be the best Valentines Day ever! (Chandler giggles and exits.) I cant believe it! Make the presents! Make the presents!"
40772,49598,9,3,The Pediatrician,Monica,Excuse me?
23349,29164,5,22,Joey`s Big Break,Joey,A swimmer!
28500,34994,6,20,Mac And C.H.E.E.S.E.,Phoebe,Happy thoughts! Happy thoughts!
36424,44465,8,6,The Halloween Party,Phoebe,Why are you lying to him?
17572,22489,4,18,Rachel`s New Dress,Chandler,Okay!
5759,7528,2,8,The List,Ross,"And, uh, and then I kissed her."
2506,3116,1,13,The Boobies,Chandler,"Are they end to end, or tall like pancakes?"
32768,40048,7,15,Joey`s New Brain,Joey,(quickly) I dont know. Why? Did you hear something?
13419,17275,3,23,Ross`s Thing,Phoebe,Okay. (watches him leave)
507,624,1,3,The Thumb,Monica,"I mean, why should I let them meet him? I mean, I bring a guy home, and within five minutes they`re all over him. I mean, they`re like- coyotes, picking off the weak members of the herd."
13589,17541,3,24,The Ultimate Fighting Champion,Phoebe,(disappointed) Oh.
19639,24843,5,5,The Kips,Ross,"Hey, so uh, y`know how there`s something I wanted to talk to you about?"
35343,43199,8,2,The Red Sweater,Rachel,"Yeah. Uh-huh, I guess it is pretty big news."
8580,11347,2,24,Barry And Mindy`s Wedding,Chandler,"Hey, what did your agent say?"
15512,19917,4,8,Chandler In A Box,Monica,I know!
34707,42324,7,23,Chandler And Monica`s Wedding,Phoebe,"Or maybe he-he was writing to tell her that-that hes changed his name, yknow? Tell Monica Im sorry."
21236,26690,5,12,Chandler`s Work Laugh,Ross,"Are you sure? Because I can stay out as late as you want. I told you how I`m on sabbatical from work, right?"
37020,45238,8,9,The Rumor,Rachel,"So Ross, we went out for two years, and you never told me you were in an I Hate Rachel club."
1546,1902,1,8,Nana Dies Twice,Phoebe,"Hey, look who`s up! How do you feel?"
28366,34846,6,20,Mac And C.H.E.E.S.E.,Joey,"I play Al Pacino`s butt. All right? He goes into the shower, and then- I`m his butt. Monica: (trying not to laugh) Oh my God. Joey: C`mon, you guys. This is a real movie, and Al Pacino`s in it, and that`s big! Chandler: Oh no, it`s terrific, it`s- it`s- y`know, you deserve this, after all your years of struggling, you`ve finally been able to crack your way into show business. Joey: Okay, okay, fine! Make jokes, I don`t care! This is a big break for me! Ross: You`re right, you`re right, it is."
16188,20757,4,12,The Embryos,Joey,Its All Relative.
22729,28424,5,19,Ross Can`t Flirt,Phoebe,I suppose I could tell her it`s just all my fault.
17005,21752,4,16,The Fake Party,Phoebe,"Its me. Its Phoebe. Listen theres something in here I want to eat, what-what smells so good?"
27089,33368,6,14,Chandler Can`t Cry,Monica,What is wrong with you?!!!
46982,57301,10,8,The Late Thanksgiving,Joey,No seriously... I`m really wedged in here.
44136,53767,9,20,The Soap Opera Party,Joey,"(browsing the tissues) Let me see if I approve any of these clowns. This guy wears a rug (discards one). This guy`s Canadian (discards another). And this guy is in a cult, ok, and it costs you 5,000$ to get to level three and I don`t feel any different."
34487,42027,7,22,Chandler`s Dad,Rachel,"(handing it to him) Yes. Here you go Officer uh, Handsome."
6081,8151,2,10,Russ,Joey,I`ve never slept with someone for a part.
3229,4303,1,18,All The Poker,Joey,"No, I don`t think so, see Ross, because I think you love her."
14260,18374,4,2,The Cat,Phoebe,Yeah?
49340,60099,10,17,"The Last One, Part I & II",Phoebe,"Just one? I drive you all the way down here, and I don`t get to see how it works out?"
29052,35744,6,23,The Ring,Phoebe,The little jail between the doors!
47307,57689,10,10,Chandler Gets Caught,Chandler,I don’t know. What do you think?
30306,37132,7,3,Phoebe`s Cookies,Rachel,"Oh wow! (She takes a bite, but holds the sandwich vertically so that the stuff falls out.)"
37236,45483,8,10,Monica`s Boots,Phoebe,"Yes! Yes you can, Im looking for Jacks parents."
25428,31415,6,6,On The Last Night,Ross,And now you want that money back.
27937,34330,6,18,Ross Dates A Student,Rachel,Oh my God! It sure didnt look this way when I lived here.
17587,22511,4,19,All The Haste,Rachel,"Monica, you dont even have a bed, you sleep in a ball on the floor!"
17395,22245,4,17,The Free Porn,Chandler,"Yeah, thats kinda a relief."
5990,7915,2,9,Phoebe`s Dad,Rachel,"Huh-huh, no act--no, uhh, that, that is basil."
34665,42277,7,23,Chandler And Monica`s Wedding,Chandler,Oh my God! (He and Monica walk away.)
37622,45965,8,12,Joey Dates Rachel,Joey,I never laughed so hardDid you see the wine come out of my nose?
13959,18030,4,1,The Jellyfish,Joey,"(lying on a beach towel, recapping what happened in the last episode) Okay, so we went to the beach, because Phoebe found out about this lady who knew her mom and dad, and I dont really know what happened with that."
